{
  "$schema": "http://json-schema.org/draft-04/schema",
  "title": "Transaction",
  "type": "object",
  "required": [ "$type" ],
  "properties": {
    "$type": {
      "type": "string",
      "default": "$transaction"
    },
    "$user_id": {
      "type": [ "string", "null" ]
    },
    "$session_id": {
      "type": [ "string", "null" ]
    },
    "$user_email": {
      "type": [ "string", "null" ]
    },
    "$transaction_type": {
      "type": [ "string", "null" ]
    },
    "$transaction_status": {
      "type": [ "string", "null" ]
    },
    "$amount": {
      "type": [ "integer", "null" ],
      "format": "long"
    },
    "$currency_code": {
      "type": [ "string", "null" ]
    },
    "$exchange_rate": {
      "oneOf": [
        { "$ref": "ComplexTypes/exchange_rate.json" },
        { "type": "null" }
      ]
    },
    "$order_id": {
      "type": [ "string", "null" ]
    },
    "$transaction_id": {
      "type": [ "string", "null" ]
    },
    "$billing_address": {
      "oneOf": [
        { "$ref": "ComplexTypes/address.json" },
        { "type": "null" }
      ]
    },
    "$payment_method": {
      "oneOf": [
        { "$ref": "ComplexTypes/payment_method.json" },
        { "type": "null" }
      ]
    },
    "$shipping_address": {
      "oneOf": [
        { "$ref": "ComplexTypes/address.json" },
        { "type": "null" }
      ]
    },
    "$seller_user_id": {
      "type": [ "string", "null" ]
    },
    "$transfer_recipient_user_id": {
      "type": [ "string", "null" ]
    },
    "$app": {
      "oneOf": [
        { "$ref": "ComplexTypes/app.json" },
        { "type": "null" }
      ]
    },
    "$browser": {
      "oneOf": [
        { "$ref": "ComplexTypes/browser.json" },
        { "type": "null" }
      ]
    },
    "$brand_name": {
      "type": [ "string", "null" ]
    },
    "$site_country": {
      "type": [ "string", "null" ]
    },
    "$site_domain": {
      "type": [ "string", "null" ]
    },
    "$ordered_from": {
      "oneOf": [
        { "$ref": "ComplexTypes/ordered_from.json" },
        { "type": "null" }
      ]
    },
    "$decline_category": {
      "type": [ "string", "null" ]
    },
    "$sent_address": {
      "oneOf": [
        { "$ref": "ComplexTypes/address.json" },
        { "type": "null" }
      ]
    },
    "$received_address": {
      "oneOf": [
        { "$ref": "ComplexTypes/address.json" },
        { "type": "null" }
      ]
    },
    "$status_3ds": {
      "type": [ "string", "null" ]
    },
    "$triggered_3ds": {
      "type": [ "string", "null" ]
    },
    "$merchant_initiated_transaction": {
      "type": [ "boolean", "null" ]
    },
    "$merchant_profile": {
      "oneOf": [
        { "$ref": "ComplexTypes/merchant_profile.json" },
        { "type": "null" }
      ]
    },
    "$digital_orders": {
      "type": [ "array", "null" ],
      "items": { "$ref": "ComplexTypes/digital_order.json" }
    },
    "$receiver_wallet_address": {
      "type": [ "string", "null" ]
    },
    "$receiver_external_address": {
      "type": [ "boolean", "null" ]
    },
    "$verification_phone_number": {
      "type": [ "string", "null" ]
    },
    "$ip": {
      "type": [ "string", "null" ]
    },
    "$minimum_deposit_amount": {
      "type": [ "integer", "null" ],
      "format": "long"
    },
    "$maximum_deposit_amount": {
      "type": [ "integer", "null" ],
      "format": "long"
    },
    "$minimum_withdrawal_amount": {
      "type": [ "integer", "null" ],
      "format": "long"
    },
    "$maximum_withdrawal_amount": {
      "type": [ "integer", "null" ],
      "format": "long"
    },
    "$current_balance": {
      "type": [ "integer", "null" ],
      "format": "long"
    },
    "$new_balance": {
      "type": [ "integer", "null" ],
      "format": "long"
    },
    "$kyc": {
      "oneOf": [
        { "$ref": "ComplexTypes/kyc.json" },
        { "type": "null" }
      ]
    },
    "$geo": {
      "oneOf": [
        { "$ref": "ComplexTypes/geo.json" },
        { "type": "null" }
      ]
    },
    "$bot_identification": {
      "oneOf": [
        { "$ref": "ComplexTypes/bot_identification.json" },
        { "type": "null" }
      ]
    }
  }
}
