{"$type":"$transaction","$user_id":"test_dotnet_transaction_event","$session_id":"sessionId","$transaction_type":"$sale","$transaction_status":"$failure","$amount":1000000000000,"$currency_code":"USD","$payment_method":{"$payment_type":"$sepa_instant_credit","$shortened_iban_first6":"FR7630","$shortened_iban_last4":"1234","$sepa_direct_debit_mandate":true},"$decline_category":"$invalid","$sent_address":{"$name":"Bill Jones","$address_1":"2100 Main Street","$address_2":"Apt 3B","$city":"New London","$region":"New Hampshire","$country":"US","$zipcode":"03257","$phone":"1-415-555-6040"},"$received_address":{"$name":"Bill Jones","$address_1":"2100 Main Street","$address_2":"Apt 3B","$city":"New London","$region":"New Hampshire","$country":"US","$zipcode":"03257","$phone":"1-415-555-6040"},"$status_3ds":"$successful","$triggered_3ds":"$processor","$merchant_initiated_transaction":true,"$merchant_profile":{"$merchant_id":"123","$merchant_category_code":"9876","$merchant_name":"ABC Merchant","$merchant_address":{"$name":"Bill Jones","$address_1":"2100 Main Street","$address_2":"Apt 3B","$city":"New London","$region":"New Hampshire","$country":"US","$zipcode":"03257","$phone":"1-415-555-6040"}}}